{
  "lectureId": "lecture-16-sql-injection",
  "lectureTitle": "SQL Injection & Command Injection",
  "lectureNumber": 16,
  "topics": [
    "Web service architecture — client/server/database",
    "SQL basics — SELECT/WHERE",
    "SQL basics — INSERT/UPDATE/DELETE",
    "SQL basics — CREATE/DROP",
    "SQL syntax characters — comments, semicolons",
    "ACID properties",
    "Declarative vs imperative",
    "String manipulation as the SQLi root cause",
    "SQLi via OR TRUE",
    "SQLi via DROP TABLE chaining",
    "SQLi error-based detection",
    "Blind SQL injection",
    "sqlmap and tooling implications",
    "Defense — input sanitization (escape/disallow)",
    "Defense — prepared statements (?) and parser-side fix",
    "Limitations of prepared statements — driver/API trust",
    "Command injection via system()",
    "Defense — safe APIs (execv, subprocess.run, exec.Command)",
    "Untrusted input as parsed language — generalization",
    "CWE-89 ranking"
  ],
  "questions": [
    {
      "id": "L16-Q01",
      "type": "DIAGRAM",
      "difficulty": "Foundational",
      "topic": "Web service architecture — client/server/database",
      "stem": "In the standard 3-tier web service diagram, which protocol typically connects the web server to the database server?",
      "choices": [
        { "id": "A", "text": "HTTP" },
        { "id": "B", "text": "SQL (over a database-specific wire protocol)" },
        { "id": "C", "text": "TCP only, with no higher-level protocol" },
        { "id": "D", "text": "DNS" }
      ],
      "correctAnswer": "B",
      "mechanisticExplanation": "The lecture's slide labels the client↔web-server link as HTTP and the web-server↔database-server link as 'SQL (usually).' SQL runs over a database-specific TCP-based wire protocol (MySQL protocol, PostgreSQL wire protocol, etc.) — but conceptually the messages flowing between the web server and the database are SQL queries and results.",
      "distractorAnalysis": {
        "A": "HTTP connects the client to the web server, not the web server to the DB.",
        "C": "TCP is the transport, but SQL is the protocol layered on top.",
        "D": "DNS is name resolution, unrelated to query/response."
      },
      "trapCategories": ["diagram-read", "architecture"],
      "diagramRef": "lecture-16-web-architecture",
      "gameRef": null
    },
    {
      "id": "L16-Q02",
      "type": "MECHANISM",
      "difficulty": "Foundational",
      "topic": "Declarative vs imperative",
      "stem": "Why is SQL described as a declarative language in contrast to imperative languages like C?",
      "choices": [
        { "id": "A", "text": "SQL specifies what result the programmer wants and lets the engine choose how to compute it; C specifies the exact step-by-step procedure." },
        { "id": "B", "text": "SQL is faster than C." },
        { "id": "C", "text": "SQL is interpreted, C is compiled." },
        { "id": "D", "text": "SQL has no functions." }
      ],
      "correctAnswer": "A",
      "mechanisticExplanation": "Declarative languages describe the desired result; the engine plans execution. Imperative languages prescribe each step. `SELECT name FROM users WHERE age > 21` says what to fetch — the database optimizer decides whether to do an index lookup, full scan, etc. C requires the programmer to write the loop and the comparison.",
      "distractorAnalysis": {
        "B": "Speed isn't the distinction.",
        "C": "Both are typically compiled to query plans / machine code.",
        "D": "SQL has stored procedures, UDFs, etc."
      },
      "trapCategories": ["definition-test"],
      "diagramRef": null,
      "gameRef": null
    },
    {
      "id": "L16-Q03",
      "type": "MECHANISM",
      "difficulty": "Core",
      "topic": "String manipulation as the SQLi root cause",
      "stem": "What is the fundamental design flaw that makes `query := fmt.Sprintf(\"SELECT name, price FROM items WHERE name = '%s'\", itemName)` vulnerable to SQL injection?",
      "choices": [
        { "id": "A", "text": "The query uses single quotes instead of double quotes." },
        { "id": "B", "text": "Untrusted input (`itemName`) is concatenated into the SQL source text *before* the SQL parser runs, so any SQL syntax in the input is parsed as code rather than treated as data." },
        { "id": "C", "text": "`fmt.Sprintf` is a deprecated function." },
        { "id": "D", "text": "The query selects too many columns." }
      ],
      "correctAnswer": "B",
      "mechanisticExplanation": "The mistake is mixing untrusted data into program source before the parser. Once the string is built, the parser cannot tell which characters were the developer's intent and which came from the user. A user who supplies `'; DROP TABLE items--` is now contributing tokens to the parse tree. The fix is structural separation: parse the SQL with placeholders first, then bind data afterward.",
      "distractorAnalysis": {
        "A": "Quote style is irrelevant to the underlying problem.",
        "C": "fmt.Sprintf isn't deprecated.",
        "D": "Query shape is irrelevant."
      },
      "trapCategories": ["mechanism-test", "data-vs-code-separation"],
      "diagramRef": null,
      "gameRef": null
    },
    {
      "id": "L16-Q04",
      "type": "GAME_WALK",
      "difficulty": "Core",
      "topic": "SQLi via OR TRUE",
      "stem": "For the URL `https://vulnerable.com/get-items?item=' OR '1' = '1`, the resulting query is `SELECT item, price FROM items WHERE name = '' OR '1' = '1'`. Why does this return every row?",
      "choices": [
        { "id": "A", "text": "The query has no WHERE clause." },
        { "id": "B", "text": "`name = ''` is generally false, but `OR '1' = '1'` is universally true. By boolean algebra, `false OR true = true`, so the WHERE filter passes for every row." },
        { "id": "C", "text": "The injection bypasses the database engine and reads the raw table file." },
        { "id": "D", "text": "`OR` causes SQL to ignore the entire WHERE clause." }
      ],
      "correctAnswer": "B",
      "mechanisticExplanation": "The injected condition is a tautology. WHERE evaluates per row; `name = ''` may or may not be true depending on the row, but `'1' = '1'` is always true, and the overall OR is always true. So the filter accepts every row, dumping the entire table to the attacker.",
      "distractorAnalysis": {
        "A": "There is a WHERE clause; it's just been logically neutralized.",
        "C": "SQLi runs through the database engine like any query.",
        "D": "OR is a normal boolean op, not a clause-disabler."
      },
      "trapCategories": ["mechanism-test", "tautology-injection"],
      "diagramRef": null,
      "gameRef": null
    },
    {
      "id": "L16-Q05",
      "type": "GAME_WALK",
      "difficulty": "Advanced",
      "topic": "SQLi via DROP TABLE chaining",
      "stem": "For the input `'; DROP TABLE items --`, the resulting query becomes `SELECT item, price FROM items WHERE name = ''; DROP TABLE items --'`. Walk through what each part of the payload achieves.",
      "choices": [
        { "id": "A", "text": "`'` closes the original quoted string; `;` ends the SELECT statement; `DROP TABLE items` is a separate destructive statement; `--` comments out the trailing `'` so the line parses cleanly." },
        { "id": "B", "text": "`'` is a SQL keyword that means 'execute next.' `DROP TABLE` is the only meaningful part; the rest is padding." },
        { "id": "C", "text": "The single quote escapes the next character, allowing `DROP` to be interpreted as data, not code." },
        { "id": "D", "text": "The payload only works because the application is using PostgreSQL." }
      ],
      "correctAnswer": "A",
      "mechanisticExplanation": "Each character has a precise role. `'` closes the string literal in the WHERE clause. `;` terminates the SELECT, allowing a second statement. `DROP TABLE items` is the second statement, enabled because the database supports multi-statement queries. `--` introduces a SQL line comment, neutralizing the trailing `'` that the developer's template was going to add. Without each piece, the injection breaks: forget the `;` and you have invalid syntax; forget the `--` and the unmatched quote breaks parsing.",
      "distractorAnalysis": {
        "B": "`'` is a string-literal delimiter, not a keyword.",
        "C": "The single quote *closes* the string, not escapes the next char.",
        "D": "Statement chaining works in many DB systems; not PG-specific."
      },
      "trapCategories": ["payload-construction", "statement-chaining"],
      "diagramRef": null,
      "gameRef": null
    },
    {
      "id": "L16-Q06",
      "type": "APPLICATION",
      "difficulty": "Core",
      "topic": "SQLi error-based detection",
      "stem": "An attacker submits `?item='` and the server responds with HTTP 500 Internal Server Error. What does this most likely indicate to the attacker?",
      "choices": [
        { "id": "A", "text": "The server is offline." },
        { "id": "B", "text": "The server is using prepared statements correctly." },
        { "id": "C", "text": "The single quote broke the SQL syntax — the application is concatenating user input into a SQL string without sanitization or prepared statements, indicating a SQLi vulnerability that can be probed further." },
        { "id": "D", "text": "The server is rate-limiting." }
      ],
      "correctAnswer": "C",
      "mechanisticExplanation": "A bare quote injected into a vulnerable string-concatenation produces unbalanced quotes in the constructed SQL, which the database refuses to parse, returning an error. The web server propagates this as 500. From the attacker's perspective, this is a strong signal: SQLi is plausible. They can then escalate to OR-TRUE injection, UNION-based extraction, or blind techniques.",
      "distractorAnalysis": {
        "A": "Offline servers don't return 500; they return connection errors.",